Timestamp,De donde son?,Hace cuanto programan (cualquier lenguaje)?,¿Qué conceptos han escuchado antes?,¿Qué herramientas han usado antes?
1/17/2023 13:35:59,Argentina,No programo,"SQL, Machine Learning, Algebra Lineal, Deep Learning","Excel, AWS, PowerBI/Tableau, Lotus123"
1/17/2023 13:36:12,Uruguay,Hace 6 meses,"Exploratory Data Analysis, Deep Learning","Lotus123, MS-DOS"
1/17/2023 13:37:04,Chile,No programo,Inteligencia artificial,Terminal de Linux/MacOS
1/17/2023 13:37:14,Colombia,Mas de 10 años,Niguna de las anteriores,Ninguna de las anteriores
1/17/2023 13:48:48,Argentina,6 meses a 2 años,"Exploratory Data Analysis, Calculo Diferencial, Limpieza de datos, SQL, Estadística inferencial, Machine Learning, Algebra Lineal, Deep Learning","VScode, Excel, AWS, PowerBI/Tableau, MS-DOS"
1/17/2023 13:50:18,Argentina,6 meses a 2 años,"Exploratory Data Analysis, Calculo Diferencial, Limpieza de datos","AWS, Lotus123"